{
  "$schema": "https://json-schema.org/draft/2020-12/schema",
  "$id": "https://trigger-protocol.org/schema/trigger-receipt.schema.json",
  "title": "Trigger Receipt v0.2",
  "description": "Portable evidence of a Trigger authorization event in the Trigger Protocol 0.2 semantic core.",
  "type": "object",
  "required": ["id", "protocol", "proposal_id", "decision_id", "proposal_hash", "actor", "authority_id", "action", "issued_at"],
  "properties": {
    "id": {"type": "string", "minLength": 1},
    "protocol": {"const": "trigger/0.2"},
    "proposal_id": {"type": "string", "minLength": 1},
    "decision_id": {"type": "string", "minLength": 1},
    "proposal_hash": {"type": "string", "minLength": 1,"pattern":"^sha256:[0-9a-f]{64}$"},
    "actor": {"type": "string", "minLength": 1},
    "authority_id": {"type": "string", "minLength": 1},
    "action": {"type": "string", "minLength": 1},
    "resource": {"type": "string"},
    "scope": {"type": "string"},
    "constraints": {"type": "object"},
    "policy_version": {"type": "string"},
    "issued_at": {"type": "string", "format": "date-time"},
    "expires_at": {"type": "string", "format": "date-time"},
    "delegation_id": {"type": "string"},
    "nonce": {"type": "string", "minLength": 1},
    "revoked": {"type": "boolean"},
    "extensions": {"type": "object"}
  },
  "additionalProperties": false
}
