{
  "id":"tr-demo-001",
  "protocol":"trigger/0.2",
  "proposal_id":"deploy-001",
  "proposal_hash":"sha256:1111111111111111111111111111111111111111111111111111111111111111",
  "decision_id":"decision-001",
  "actor":"human:oncall",
  "authority_id":"production-release",
  "action":"deploy",
  "resource":"service:example",
  "scope":"production",
  "constraints":{"environment":"production","service":"example"},
  "policy_version":"release-policy/7",
  "issued_at":"2026-01-01T11:00:00Z",
  "expires_at":"2099-01-01T12:00:00Z",
  "nonce":"demo-deploy-001"
}